Country,Publishing organisations,Organisation size,Results,Jury's comments,Project title,Publication date,Tags,Technologies tools used,A short description of the project,What was the impact of the project,What tools techniques technologies did you use and how did you use them,What was the hardest part of this project What should the jury know to better understand what you did and why it should be selected ,What can other journalists learn from this project,Languages,Project link 1,Project link 2,Project link 3,Project link 4,Project link 5,Project link 6,Project link 7,Project link 8,Who made this project,Short biography/ies,
Italy,International School for Advanced Studies (SISSA),Small,Shortlist,,The Great Wave,13/09/21,"Long-form, Infographics, Chart, Video, Health","Animation, Personalisation, Scraping, Json, Adobe Creative Suite, CSV, R","The Great Wave is a project developed during a year-long data journalism fellowship at the International School for Advanced Studies (SISSA) in Trieste, Italy, a research center that focuses on physics, neuroscience, mathematics and science communication. Its purpose was to think about the pandemic and its effects in a more systematic way, taking a step back from emergency writing to get a broader look at what happened in 2020. We wanted to understand what did we think about the virus, how did we know it, and whether it was the best use of available scientific evidence, especially in the West.","The results of our project were featured in national and local media in Italy, sparking debates around the timing and effectiveness of the country’s pandemic response. Some public health authorities denied our FOIA requests, and the lack of transparency around critical epidemiological data was also one of the most contested issues.","Data visualization was key to our project. We wanted to report the best available evidence we could find sifting through hundreds of papers, and talking to dozens of experts, in a concise and compelling way. At the same time, given the topic we absolutely wanted to avoid compiling a statistical atlas of the pandemic. Working with information designer Federica Fragapane, we designed our visualizations to make numbers as human as possible. Every time we showed individuals, for example, we made them look all different from each other. There are no two identical objects to represent them. For us it was very important to remind readers that we were talking about people and their stories, not abstract figures. This was the principle that led us to design many hand-made visualizations, crafted from scratch instead of using off the shelf tools.","Our goal, especially in the first half of project, was to try to give some dignity and respect to everybody involved. This was a story about people that lost family, friends, loved ones, and we wanted to do all we could to show empathy and compassion, which is especially hard when working with numbers. One such example can be found in the first chapter when we talked about what happened in Bergamo, the most hit Italian area during the first wave. To give readers an idea of the amount of destruction the virus brought, we tracked each of the excess deaths as best as we could, through all available public information. We then built a simulation of their social structure using demographic data to show how many family members were left without their loved ones.","This project taught us that data driven journalism was invaluable in understanding and reporting this pandemic, but also carried the risk of being cold and heartless. We strived for balance between rigor and humanity. Numbers are great for telling some stories, but - like when we talked about mental health - they also can have large limitations. You can't really use data to talk about feelings in a meaningful way, for example, and so we didn't. Sometimes all that's needed is just a voice. Our hope is that those lessons can be of use to other journalists as well.","English, Italian",http://www.grandeonda.it/en/,,,,,,,,Federica Fragapane,"Davide Mancino (1983) lives in Turin, Italy. He is a visual journalist, information designer and trainer. His collaborations include news outlets in the United States like Fivethirtyeight and Quartz, others in Spain and Germany. In Italy he writes for Il Corriere della Sera and Il Sole 24 Ore.",
Turkey,Journo,Small,Shortlist,,News Deserts Spread in Turkey,24/02/21,"Investigation, Explainer, Database, News application, Map","Scraping, JQuery, Microsoft Excel, Google Sheets, Python","Over the course of two weeks in February 2021, we scraped more than a million news articles from more than 6,500 Turkish news websites in which the names of 973 administrative districts of Turkey appear. With a choropleth map, we revealed which districts have the highest or lowest news coverage per capita, and which districts of Turkey face the risk of emerging ""news deserts."" We also analyzed the authenticity of news content for each district, showing where original reporting is We hope that this research has humbly contributed to a subject area with hardly any data about digital journalism in","Until our study, there was no data about the geographical scope and originality of digital journalism in Turkey. For the first time, we presented the public data-based insights on the issue, showing that news deserts are spreading in certain parts of Turkey —particularly the Inner Aegean, Central Anatolian, and Eastern regions where President Erdogan's ruling Justice and Develıpment Party (AKP) dominates, while original reporting is surprisingly higher in other areas, including the Kurdish-majority Southeast region and in most strongholds of the main opposition Republican People's Party (CHP) across the country.  Perhaps the most striking findings showed that 85% of the news articles published in Turkish digital media are not original reporting but are merely copy-pasted from initial sources (particularly the news agencies). Meanwhile, many provinces that seem like an ""oasis"" in the gross number of news articles are actually ""deserts"" of original journalism. Our results were reported by dozens of news outlets in national and local media. We were interviewed by seven newspapers, five national TV networks, and one national radio channel. The Global Investigative Journalism Network (GIJN) shared our story through its social media accounts and its newsletter. According to our estimates, the project reached more than 13 million people in Turkey through conventional and digital media outlets. We were also hosted at panels to present our findings at physical and online events organized by respected institutions like Columbia University's Global Centers in Istanbul, the European Endowment for Democracy, the International Press Institute, and the Journalists' Association in Ankara. Kizilkaya will also talk about this project at the Data Visualization Society's Outlier Conference in February 2022.","We manually constructed a dataset of more than 6,500 news websites —including almost all national, regional and local outlets in Turkey. We coded a Python script and used jQuery to scrape the articles that these news websites published for two weeks. We then built a knowledge graph to analyze this Turkish-language news content, semantically pinpointing the administrative district names in each article, while also assigning them ""originality scores"" by using a custom algorithm. We computed all results in a custom-designed macro-powered spreadsheet, completing the analysis and data visualization by using Tableau and Datawrapper. As we adhere to the principles of open data, we published the dataset as part of our feature article about this study on our non-profit news website Journo.com.tr in Turkish and in English (see Project Link 3 for the dataset). Several Turkish and international communication academics contacted us to thank us for releasing the dataset and explaining the methodology so that they can replicate or expand this study on Turkish journalism. ","Turkey is a highly challenging country for media outlets. Journalists are being jailed like in China, physically or virtually assaulted like in Russia, and are forced to self-censor like in many Asian and African countries. Independent media outlets are shut down or heavily fined like in Iran, the cronies of the government capture newspapers and TV outlets like in Hungary, and the public broadcaster is under heavy government influence like in Romania and Bulgaria. Independent journalists are labeled as “traitors”, and pro-government media spread fake news like in Serbia, while defamation laws are weaponized by the ruling elite like in Poland. How these challenges affect original reporting in Turkey was a big question mark because there was no extensive study on the subject until we embarked on this route. The hardest part of our project is to come up with a viable method to answer at least a part of this question. After we figured out how we can technically scrape and then semantically analyze so many news articles, the rest was all about succinctly and aesthetically presenting the significant findings related to this Big Data. We narrated our data-based story on these findings and designed social media posts in accordance with the features of the specific audiences and algorithms on various platforms.  ","We believe that this project has humbly contributed to a subject area with hardly any data about digital journalism in Turkey. Our findings should be particularly helpful for those who try to understand the current state of local journalism and original reporting in Turkey amid so many challenges. Journalists can benefit from this study especially by focusing on the geographical discrepancies of original news reporting. In some provinces, we showed that two neighboring districts may be hugely different in this regard. Although they share similar resources and features, one district may have a significantly higher rate of original journalism than its neighbor. As an on-the-field follow-up to this data journalism study, the Journo website sent its reporters to three geographical regions to investigate the reasons behind these discrepancies (see Project Link 4 for these three news articles).   By using this work, Turkish journalists can now microscopically analyze the supply-demand of news reporting on the district level, and use these actionable insights to decide about their newsroom's operations on the ground. Our main map simply shows where newsrooms can invest (for instance, by hiring more local reporters there) because there is an opportunity to satisfy the public demand for original reporting per capita in certain districts. They can also quickly see where competition in local journalism is relatively more intense.  Local journalism is the heart of any democracy. We hope that these findings will also serve the reporters and media executives in their endeavor to inform the public, including the electorate in rural districts, in line with universal standards and rules of high-quality, original journalism.","English, Turkish",https://journo.com.tr/turkey-news-deserts,https://journo.com.tr/haber-colleri,https://docs.google.com/spreadsheets/u/1/d/1UGyBHkpW2PQdIWpqdtTb1P_VzLSz3Q-vFr_6l1ISgzs/edit?usp=sharing,https://journo.com.tr/konu/neden-col-niye-vaha,,,,,"EMRE KIZILKAYA, EMRAH YILMAZ","Emre Kizilkaya worked for Hurriyet newspaper, the flagship outlet of Turkey's largest media corporation, for more than 10 years during which he served as digital coordinator and managing editor. He completed the Knight Visiting Nieman Fellowship at Harvard in 2019, focusing on media sustainability. He is now a vice-chair of the Vienna-based International Press Institute (IPI), and the Project Editor of Journo.com.tr, a news platform for Turkey's next-generation journalists, supported by the Journalists' Union (TGS) and the EU. Emrah Yilmaz is a freelance web developer and data scientist. He worked for Turkey's two leading media monitoring agencies for 12 years.",
Spain,El País,Big,Shortlist,,Avoiding coronavirus infection in indoor spaces: don't breathe other people's air,29/03/21,"Investigation, Explainer, Infographics, Chart, Health","Animation, 3D modelling, Microsoft Excel","Constant ventilation and permanent control of CO₂ levels are two of the keys to avoiding transmission in closed rooms, as fresh air dilutes the infected particles",This report was visited by half a million people in its versions in English and Spanish. It is one of the most viewed contents of the El País science department in 2021. The clarity with which it explains the accumulation of infectious aerosols has been valued by scientists from several countries and hundreds of readers and teachers.,"We use a CO2 meter for hours of measurements in different closed spaces such as cars, elevators and rooms. These data were represented visually through tools such as Excel and Adobe After Effects. 3D models and animations were made in Adobe After Effects","After taking more than 20 CO2 samples from more than a dozen locations, the hardest part was designing an effective visual narrative to show accumulated aerosols and how they dissipate when ventilated.",To always look in their articles for a point of utility and service journalism. While we report indoor aerosol build-up we also provide helpful information to reduce risks.,"English, Spanish",https://elpais.com/especiales/coronavirus-covid-19/how-to-avoid-the-infection-in-indoor-spaces/,,,,,,,,Mariano Zafra and Javier Salas,"Since October 2019 I lead the Graphic and Storytelling team of El País, in Madrid. During the last four years I worked as a Graphics Reporter for special projects in The Wall Street Journal, in New York, and I started and led the Infographic and Data Visualization Department of Univision News in Miami. Before moving to the United States, I spent fourteen years working at the two most prominent national daily newspapers in Spain: El Mundo and El País.",
Brazil,"g1, O Globo, Extra, O Estado de S.Paulo, Folha de S.Paulo, UOL",Big,Shortlist,,Consórcio de veículos de imprensa (Consortium of press vehicles),24/03/21,"Investigation, Multiple-newsroom collaboration, Database, Open data, Health",Google Sheets,"This is an unprecedented initiative involving six of the main vehicles of communication in Brazil to promote the transparency of data on cases and deaths caused by Covid-19 and, more recently, on applied vaccines. In the consortium, teams share tasks and the information obtained so that Brazilians can learn about the evolution of Covid-19, the consolidated numbers of tested cases with positive results for the new coronavirus and the doses of vaccines applied in all units of the federation. A balance is released daily. It is a fundamental service, broadcast on all platforms and with unquestionable journalistic relevance.","The consortium was formed in response to the decision by the government of president Jair Bolsonaro to restrict access to data on the pandemic. So, g1, O Globo, Extra, O Estado de S.Paulo, Folha de S.Paulo and UOL decided to form a partnership, leaving the competition aside, to work collaboratively in search of the necessary information in the 26 states and the District Federal. Something new, but innovative and necessary. By joining forces and showing their commitment to informing, the vehicles sent a sign of confidence to the population in the professional media and reinforced their fundamental role of demanding transparency from government entities. There has never been a journalistic partnership between the vehicles, direct competitors before. Journalism's mission to inform the population, however, made it necessary to act at a decisive moment in the midst of the pandemic. The speed with which the teams were formed to collect the data, the accuracy of the information and the concern with the public are outstanding characteristics of this partnership. The daily collaboration between newsrooms around a common goal makes the consortium a unique initiative. The consortium became a national reference. The data are considered more reliable than those released by the Ministry of Health. The partnership is today the main source of information for other press vehicles and is seen as a fundamental channel by the population.","There is a whole concern with the verification of the data. A careful collection is carried out in each unit of the federation (that is, in the 26 states and the Federal District), whether by email, WhatsApp, website or phone, and a spreadsheet (of Google), which all vehicles have access to, is used to consolidate the information. There is an entire collaborative process carried out in an organized manner, with the objective of providing the population with the most faithful and accurate picture of the current situation of the pandemic. The cells are automated in the spreadsheet, providing a daily bulletin to be shared with all newsrooms, to be published daily at 8 pm. Each vehicle, however, has its way of disclosing data. On g1, for example, there is also a map: https://especiais.g1.globo.com/bemestar/coronavirus/estados-brasil-mortes-casos-media-movel/ ","There are more than 100 journalists involved in the project, spread across the newsrooms of six competing vehicles in Brazil. The organization of work and collaboration involving reporters and newsroom editors with different ways of working are, without a doubt, one of the hallmarks of this partnership. It is no easy task to make a task force like this work, organically and without errors, for so long. This is an unprecedented, exclusive and unique initiative in the Brazilian media.","Journalism lives. Journalism breathes. And its role, of promoting transparency and providing an essential service to the public, always speaks louder. The purpose of bringing information to the public is the engine of this collaboration. A purpose that motivates much more than competition.",Portuguese,https://g1.globo.com/politica/noticia/2021/10/20/consorcio-de-veiculos-de-imprensa-completa-500-dias-de-trabalho-colaborativo.ghtml,https://g1.globo.com/bemestar/coronavirus/noticia/2021/04/29/400-mil-mortes-covid.ghtml,https://oglobo.globo.com/saude/coronavirus/numero-de-mortos-por-covid-19-ultrapassa-350-mil-no-brasil-pais-volta-registrar-media-acima-de-3-mil-mortes-por-dia-24965561,https://extra.globo.com/noticias/coronavirus/brasil-tem-mais-de-100-milhoes-de-vacinados-com-primeira-dose-contra-covid-19-25134610.html,"https://saude.estadao.com.br/noticias/geral,brasil-atinge-a-marca-de-450-mil-mortes-por-covid-19,70003725280",https://www1.folha.uol.com.br/equilibrioesaude/2021/03/brasil-chega-a-300-mil-mortos-por-covid-apenas-75-dias-depois-de-registrar-200-mil.shtml,https://www.uol.com.br/vivabem/noticias/redacao/2021/07/29/vacinacao-covid-19-coronavirus-29-de-julho.htm,,"Renato Franzini (g1), Constança Tatsch (O Globo), Adriana Dias (Extra), Daniel Bramatti (O Estado de S.Paulo), Flávia Faria (Folha de S.Paulo), Marcos Sérgio Silva (UOL)",Representatives of each vehicle: g1 - Renato Franzini O Globo – Constança Tatsch Extra – Adriana Dias O Estado de S.Paulo – Daniel Bramatti Folha de S.Paulo – Flávia Faria UOL – Marcos Sérgio Silva,
Indonesia,Katadata Indonesia,Small,Shortlist,,Katadata Indonesia,23/11/21,"Database, Infographics, Chart, Video, Environment, Health","Animation, 3D modelling, OpenStreetMap","Restrictions on residents' activities during the Covid-19 are believed to reduced air pollution over the city of Jakarta. However, air quality index data reveals the opposite fact that pollution still surrounds the capital city.  In fact, some residents still believe that Jakarta's air is not completely bad. This is evident from the results of a survey conducted by the Katadata Insight Center (KIC) in August 2021. We also summarize a number of ""myths"" that some of the residents believe. As a comparison, we used data collected by Nafas, a startup provider of air quality measurement applications.  ","The poor air quality in Jakarta and its surrounding areas should be a lesson that air pollution is the enemy of all of us. Because, this can have an impact on health in the future. Residents of the capital city needs to encourage the government to immediately deal with sources of pollution in the capital city. For example, by conducting emission tests for cars, factories, and so on.","We interviewed the governments, the observers, and the startup who provides air quality measurement. We use Flourish and Microsoft Excel to calculate and analyze the data that we collect.",Gather all the informations we need and analyze our findings based on the data.,"The importance of data to strengthen the argument in our article. In this case, is about how bad the air quality is in Jakarta, Indonesia.",Bahasa Indonesia,https://katadata.co.id/polusi-udara,https://katadata.co.id/ariayudhistira/analisisdata/61a5f14e4b4b9/alarm-baru-bahaya-udara-jakarta,https://katadata.co.id/ariaw/analisisdata/61a5f1c23910d/polusi-tak-berkurang-meski-pandemi,https://katadata.co.id/ariaw/analisisdata/61a5f243c56fc/meluruskan-mitos-mitos-udara-bersih-di-sekitar-kita,https://katadata.co.id/ariaw/analisisdata/61a5f29cd82ee/video-the-silent-killer-udara-jakarta,,,,"Cindy Mutia Annur, Dimas Jarot, Monavia Ayu, Ratri Kartika","The authors are part of the data journalism team at Katadata Indonesia. They write articles on various topics such as business-economics, social, to politics based on data.",
Nigeria,"International Centre for Investigative Reporting, BusinessDay",Small,Shortlist,,Money for the boys: How agberos pocket billions of Lagos transport revenue,19/07/21,"Investigation, Corruption, Economy",Canvas,"The project focuses on how non-state actors collect transport revenue belonging to Lagos State, Nigeria's richest state, and pocket it. Ana analysis of data shows that they amount of money collected by these non-state actors is $300 million annually. I checked the Lagos State financial statements to asvcertain whether government keeps record of their colections but did not find the record anywhere. I contacted Lagos State Internal Revenue Service and the Lagos State Ministry of Finance but neither could give account of the money. This is the first time anybody could use data to identify financial leakages in Lagos State","The project led to several rebuttals by the Lagos State government and the Lagos Internal Revenue Service. The Lagos State government claims it is now involved in the collection of transport taxes, though there is no evidence that corruption has stopped in the process.   ","I gathered information from local governments in Lagos State and used the information to obtain an average amount collected each day, month and year.  I was able to obtain the number of vehicles, tricycles and motorcycles in Lagos from open source tools and questionnaires obtained from drivers on Lagos roads, and  transport touts.  I then used Canvas for visualisation.","It was very difficult to visit 21 out of 37 local government development areas in Lagos. Secondly, it was also difficult to obtain information from commercial vehicle divers and transport touts themselves. I had to accept to not publish their names before they could give out important information that supported the story. Originally, I went out to seek information on how much these non-state actors collected each year, with the hope that government would have that. But when I could not get it from the government agencies that should have the records, I went through Lagos State's financial statements. Government officials, including one mentioned in the story, wanted to meet me physcically to stop the story but I did not accept to meet him.  It involved some creativity to be able to generate the data myself, after intervewing up to 100 persons for the story. Interviewing those people at bus stops is hard as I was insulted and rebuffed on many occasions. Also, getting the pictures of the perpetrators was really hard. I had to use secret cameras to avoid ""being caught"" by the criminals who could have harmed me.","Journalists cam learn that it is possbible to get original data on any illegal transaction by government. All that is needed is to get micro data from the people involved and extrapolate to a larger population.  Doing this, however, involves skills .  Also, data should not be 100 per cent accurate before they are accepted as correct. The process of gathering data determines whether data is correct or not. So, journalists should pay attention to the process of gathering data, rather than just the final product. ",English,https://www.icirnigeria.org/money-for-the-boys-how-agberos-pocket-billions-of-lagos-transport-revenue/,https://www.icirnigeria.org/profiting-from-illegality-lagos-govt-watches-as-local-councils-touts-exploit-proscribed-cyclists/,https://www.icirnigeria.org/lagos-micro-businesses-in-the-grip-of-area-boys/,https://www.icirnigeria.org/inside-lagos-local-government-councils-where-officials-divert-taxes-to-personal-bank-accounts/,https://businessday.ng/news/article/ongoing-projects-in-south-east-truth-vs-lies/,,,,Odinaka Anudu,"Odinaka Anudu is News Editor of the International Centre for Investigative Reporting. He had worked in BusinessDay Nigeria as Assistant Editor and Head of Investigations. He had also worked as South-East Bureau Chief at Orient Magazine and Newspaper in Nigeria.  He has over 11 years of experience in the media. He has won a number of journalism awards,  including  African Fact-Checking Awards, Citi Journalistic Excellence Award, and PwC Media Excellence Award, among others. He was educated at Nnamdi Azikiwe University in Nigeria and the University of Salford, UK. ",
